file_id	full_name	gender	quote
severe-weather-linked-more-strongly-to-global-warming-1.17828	Noah Diffenbaugh	MALE	"This perspective piece is refocusing our attention on the underlying causes and on the underlying ingredients of extreme weather,"
severe-weather-linked-more-strongly-to-global-warming-1.17828	Noah Diffenbaugh	MALE	That's a really helpful message.
severe-weather-linked-more-strongly-to-global-warming-1.17828	Martin Hoerling	MALE	"Extreme events are not borne of high water vapour and warm oceans alone,"
severe-weather-linked-more-strongly-to-global-warming-1.17828	Judah Cohen	MALE	"but will do little to settle or alleviate the differences,"
severe-weather-linked-more-strongly-to-global-warming-1.17828	Kevin Trenberth	MALE	"A small change can make a big difference,"
severe-weather-linked-more-strongly-to-global-warming-1.17828	Kevin Trenberth	MALE	"That's the thing that breaks the record and pushes you beyond previous thresholds, and that's when the damage goes up enormously."
severe-weather-linked-more-strongly-to-global-warming-1.17828	Kevin Trenberth	MALE	Our paper provides a framework for giving some answers.
structural-biologist-named-president-of-uk-royal-society-1.17153	James Wilsdon	MALE	"He's clearly got the scientific credentials,"
structural-biologist-named-president-of-uk-royal-society-1.17153	James Wilsdon	MALE	It's always a positive when the president comes with a Nobel prize.
structural-biologist-named-president-of-uk-royal-society-1.17153	Venkatraman Ramakrishnan	MALE	"It's a great honour,"
structural-biologist-named-president-of-uk-royal-society-1.17153	Ramakrishnan	MALE	"I think I'm a good listener,"
structural-biologist-named-president-of-uk-royal-society-1.17153	Ramakrishnan	MALE	"at least, I'll have to be."
structural-biologist-named-president-of-uk-royal-society-1.17153	Venkatraman Ramakrishnan	MALE	"Paul has been an articulate and forceful advocate for science, and I can only do my best to continue that."
structural-biologist-named-president-of-uk-royal-society-1.17153	Venkatraman Ramakrishnan	MALE	"That breadth is something I hope will help me,"
structural-biologist-named-president-of-uk-royal-society-1.17153	Paul Nurse	MALE	cowardly
structural-biologist-named-president-of-uk-royal-society-1.17153	James Wilsdon	MALE	"Venki embodies the cosmopolitan nature of contemporary science,"
structural-biologist-named-president-of-uk-royal-society-1.17153	James Wilsdon	MALE	There's less of a sense of what his vision will be.
structural-biologist-named-president-of-uk-royal-society-1.17153	James Wilsdon	MALE	"The president is a critical voice in those debates,"
structural-biologist-named-president-of-uk-royal-society-1.17153	James Wilsdon	MALE	"Paul combines great academic strength with down-to-Earth affability,"
structural-biologist-named-president-of-uk-royal-society-1.17153	James Wilsdon	MALE	He's been a very effective leader and ambassador for science.
us-precision-medicine-proposal-sparks-questions-1.16774	Barack Obama	MALE	"I want the country that eliminated polio and mapped the human genome to lead a new era of medicine — one that delivers the right treatment at the right time,"
us-precision-medicine-proposal-sparks-questions-1.16774	David Ledbetter	MALE	"My personal attitude is always to try to collaborate rather than duplicate and compete in an inefficient way,"
us-science-academies-take-on-human-genome-editing-1.17581	Ralph Cicerone	MALE	"really more international than Asilomar ever had to be,"
us-science-academies-take-on-human-genome-editing-1.17581	Jennifer Doudna	FEMALE	" I am delighted that the NAS and the NAM are leading a discussion of these important issues,"
us-science-academies-take-on-human-genome-editing-1.17581	Jennifer Doudna	FEMALE	"This is indeed the kind of response we hoped to trigger,"
us-science-academies-take-on-human-genome-editing-1.17581	Marcy Darnovsky	FEMALE	"That was not an inclusive meeting,"
us-science-academies-take-on-human-genome-editing-1.17581	Marcy Darnovsky	FEMALE	It was an effort at fending off any sort of binding policy in favour of self-regulation.
us-science-academies-take-on-human-genome-editing-1.17581	Paul Berg	MALE	"The idea is to get the idea out, and to get it out by a highly focused conference with the expectation that this is going to resound much louder and wider,"
us-science-academies-take-on-human-genome-editing-1.17581	Jennifer Doudna	FEMALE	Whether a larger or more public forum is needed depends on how the initiative proceeds.
us-science-academies-take-on-human-genome-editing-1.17581	Paul Berg	MALE	Then there will be different ways of dealing with those [ideas].